{
  "artifact": {
    "artifact_version": "temperature-scaling-1.0.0",
    "byte_count": 1040,
    "relative_path": "artifacts/cfpb/transformer/cfpb-run-20260722T130728Z-2b7815d4c850/calibration/temperature-scaling-1.0.0.json",
    "retention": "local_only_governed_until_2026-11-19",
    "sha256": "3fc439322d7bc32d7f0bfbdef6f5383bfc0867e595bad340340aba9909a66800"
  },
  "calibrated_at_utc": "2026-07-24T16:25:46.440783Z",
  "checks": {
    "accepted_predictions_reproduced": true,
    "artifact_hashed": true,
    "class_counts_reconcile": true,
    "model_artifact_verified_before_load": true,
    "partition_counts_reconcile": true,
    "predictions_unchanged": true,
    "probabilities_finite_and_normalized": true,
    "source_identity_reconciled": true,
    "test_accessed": false,
    "top_2_unchanged": true
  },
  "claims": {
    "final_operational_model_selected": false,
    "interpretation": "validation_only_temperature_calibration",
    "operational_threshold_selected": false,
    "portfolio_promotion_approved": false,
    "test_used_for_calibration": false
  },
  "data": {
    "evaluation_split": "validation",
    "labels": [
      "Checking or savings account",
      "Credit card",
      "Credit reporting or other personal consumer reports",
      "Debt collection",
      "Debt or credit management",
      "Money transfer, virtual currency, or money service",
      "Mortgage",
      "Payday loan, title loan, personal loan, or advance loan",
      "Prepaid card",
      "Student loan",
      "Vehicle loan or lease"
    ],
    "partitions": [
      {
        "class_counts": {
          "Checking or savings account": 2347,
          "Credit card": 2543,
          "Credit reporting or other personal consumer reports": 26300,
          "Debt collection": 4101,
          "Debt or credit management": 98,
          "Money transfer, virtual currency, or money service": 782,
          "Mortgage": 1025,
          "Payday loan, title loan, personal loan, or advance loan": 414,
          "Prepaid card": 184,
          "Student loan": 756,
          "Vehicle loan or lease": 611
        },
        "end_exclusive": "2024-10-01",
        "partition": "calibration_fit",
        "record_count": 39161,
        "start_inclusive": "2024-09-01"
      },
      {
        "class_counts": {
          "Checking or savings account": 2614,
          "Credit card": 2652,
          "Credit reporting or other personal consumer reports": 27712,
          "Debt collection": 4683,
          "Debt or credit management": 129,
          "Money transfer, virtual currency, or money service": 902,
          "Mortgage": 1011,
          "Payday loan, title loan, personal loan, or advance loan": 491,
          "Prepaid card": 268,
          "Student loan": 725,
          "Vehicle loan or lease": 644
        },
        "end_exclusive": "2024-11-01",
        "partition": "calibration_evaluation",
        "record_count": 41831,
        "start_inclusive": "2024-10-01"
      }
    ],
    "test_accessed": false
  },
  "eligibility": {
    "calibrator_eligible_for_ct306": true,
    "checks": {
      "argmax_unchanged": true,
      "evaluation_brier_guard_passed": true,
      "evaluation_nll_improved": true,
      "optimizer_converged_away_from_bounds": true,
      "partition_counts_reconcile": true,
      "probabilities_valid": true,
      "top_2_membership_unchanged": true
    },
    "final_operational_model_selected": false,
    "proposal_for_ct306": "calibrated_transformer_probabilities"
  },
  "limitations": [
    "base_model_selected_using_complete_validation_period",
    "september_metrics_are_in_sample_calibration_fit_diagnostics",
    "october_metrics_are_validation_tuning_evidence_not_final_test_evidence",
    "temperature_scaling_cannot_fix_class_specific_or_input_dependent_miscalibration",
    "ece_estimates_depend_on_declared_binning",
    "rare_class_calibration_metrics_have_higher_variance",
    "no_abstention_threshold_selected_in_ct305"
  ],
  "method": {
    "kind": "scalar_temperature_scaling",
    "maximum_iterations": 500,
    "objective": "mean_categorical_negative_log_likelihood",
    "optimizer_converged": true,
    "optimizer_function_calls": 20,
    "optimizer_iterations": 20,
    "parameterization": "bounded_log_temperature",
    "temperature": 1.041049944456901,
    "temperature_lower_bound": 0.05,
    "temperature_upper_bound": 20.0,
    "xatol_log_temperature": 1e-08
  },
  "privacy": {
    "artifact_git_tracking_allowed": false,
    "contains_complaint_ids": false,
    "contains_narratives": false,
    "contains_row_logits": false,
    "contains_row_probabilities": false,
    "contains_row_values": false,
    "contains_token_ids": false,
    "report_git_tracking_allowed": true
  },
  "report_version": "transformer-temperature-calibration-1.0.0",
  "results": {
    "calibration_evaluation": {
      "after": {
        "accuracy": 0.882120915110803,
        "equal_width_reliability_bins": [
          {
            "absolute_gap": null,
            "accuracy": null,
            "bin_index": 0,
            "correct_count": 0,
            "lower_inclusive": 0.0,
            "mean_confidence": null,
            "record_count": 0,
            "upper_exclusive": 0.06666666666666667,
            "upper_inclusive": null
          },
          {
            "absolute_gap": null,
            "accuracy": null,
            "bin_index": 1,
            "correct_count": 0,
            "lower_inclusive": 0.06666666666666667,
            "mean_confidence": null,
            "record_count": 0,
            "upper_exclusive": 0.13333333333333333,
            "upper_inclusive": null
          },
          {
            "absolute_gap": 0.016170121840300256,
            "accuracy": 0.2,
            "bin_index": 2,
            "correct_count": 1,
            "lower_inclusive": 0.13333333333333333,
            "mean_confidence": 0.18382987815969976,
            "record_count": 5,
            "upper_exclusive": 0.2,
            "upper_inclusive": null
          },
          {
            "absolute_gap": 0.1102305781879715,
            "accuracy": 0.3488372093023256,
            "bin_index": 3,
            "correct_count": 15,
            "lower_inclusive": 0.2,
            "mean_confidence": 0.2386066311143541,
            "record_count": 43,
            "upper_exclusive": 0.26666666666666666,
            "upper_inclusive": null
          },
          {
            "absolute_gap": 0.023115322224109836,
            "accuracy": 0.328125,
            "bin_index": 4,
            "correct_count": 42,
            "lower_inclusive": 0.26666666666666666,
            "mean_confidence": 0.30500967777589016,
            "record_count": 128,
            "upper_exclusive": 0.3333333333333333,
            "upper_inclusive": null
          },
          {
            "absolute_gap": 0.002936673234046061,
            "accuracy": 0.36824324324324326,
            "bin_index": 5,
            "correct_count": 109,
            "lower_inclusive": 0.3333333333333333,
            "mean_confidence": 0.3711799164772893,
            "record_count": 296,
            "upper_exclusive": 0.4,
            "upper_inclusive": null
          },
          {
            "absolute_gap": 0.01172471435369593,
            "accuracy": 0.45090180360721444,
            "bin_index": 6,
            "correct_count": 225,
            "lower_inclusive": 0.4,
            "mean_confidence": 0.4391770892535185,
            "record_count": 499,
            "upper_exclusive": 0.4666666666666667,
            "upper_inclusive": null
          },
          {
            "absolute_gap": 0.003249566915494384,
            "accuracy": 0.4984984984984985,
            "bin_index": 7,
            "correct_count": 498,
            "lower_inclusive": 0.4666666666666667,
            "mean_confidence": 0.5017480654139929,
            "record_count": 999,
            "upper_exclusive": 0.5333333333333333,
            "upper_inclusive": null
          },
          {
            "absolute_gap": 0.046392309438620716,
            "accuracy": 0.5206136145733461,
            "bin_index": 8,
            "correct_count": 543,
            "lower_inclusive": 0.5333333333333333,
            "mean_confidence": 0.5670059240119668,
            "record_count": 1043,
            "upper_exclusive": 0.6,
            "upper_inclusive": null
          },
          {
            "absolute_gap": 0.04178626252666928,
            "accuracy": 0.5920066611157369,
            "bin_index": 9,
            "correct_count": 711,
            "lower_inclusive": 0.6,
            "mean_confidence": 0.6337929236424061,
            "record_count": 1201,
            "upper_exclusive": 0.6666666666666666,
            "upper_inclusive": null
          },
          {
            "absolute_gap": 0.0348450122366335,
            "accuracy": 0.6657223796033994,
            "bin_index": 10,
            "correct_count": 940,
            "lower_inclusive": 0.6666666666666666,
            "mean_confidence": 0.7005673918400329,
            "record_count": 1412,
            "upper_exclusive": 0.7333333333333333,
            "upper_inclusive": null
          },
          {
            "absolute_gap": 0.060808393532609806,
            "accuracy": 0.7072152653548003,
            "bin_index": 11,
            "correct_count": 1186,
            "lower_inclusive": 0.7333333333333333,
            "mean_confidence": 0.7680236588874101,
            "record_count": 1677,
            "upper_exclusive": 0.8,
            "upper_inclusive": null
          },
          {
            "absolute_gap": 0.048955606026613196,
            "accuracy": 0.7873859579531932,
            "bin_index": 12,
            "correct_count": 1985,
            "lower_inclusive": 0.8,
            "mean_confidence": 0.8363415639798064,
            "record_count": 2521,
            "upper_exclusive": 0.8666666666666667,
            "upper_inclusive": null
          },
          {